{
  "requestId": "request-resource-mismatch-001",
  "actor": {
    "actorId": "actor-ra-001",
    "name": "Research Assistant",
    "role": "ResearchAssistant",
    "authorityNodeId": "node-007"
  },
  "action": "dataset.submit",
  "resource": {
    "resourceId": "Dataset999",
    "resourceType": "dataset",
    "resourceName": "Different Restricted Dataset"
  },
  "purpose": "ProjectX research submission",
  "timestamp": "2026-08-15T10:00:00Z",
  "delegationId": "delegation-valid-001",
  "requestContext": {
    "projectId": "ProjectX",
    "system": "pilot-repository",
    "requestChannel": "example-fixture",
    "notes": "Resource-mismatch request. Delegation applies to Dataset123 but request attempts Dataset999."
  }
}
